Area,Location_Score,Square_Feet,Num_Bedrooms,Building_Age,Owner_Name,Street_Address,Price_BDT
Shashongacha,2.0,800,2,15,শ্রাবন্তী সরকার,"৮, পূর্ব মাধবমাটি ঘাট, Shashongacha, Cumilla",3101938.15
Chawkbazar,2.2,1725,3,0,অন্তরা খান,"১৩, পশ্চিম হোসেনমহাসড়ক, Chawkbazar, Cumilla",5603571.48
Jhawtala,3.8,1561,2,13,শান্ত দাশগুপ্তা,"৮, উত্তর শিবনগর, Jhawtala, Cumilla",6876910.34
Kandirpar,4.0,800,2,13,মুনতাকিম হাকিম,"৫৫২, দাউদদিয়া মহাসড়ক, Kandirpar, Cumilla",5034599.95
Chawkbazar,2.2,1363,2,21,বিপাশা খান,"২৫৪, উত্তর শরণডাঙ্গা, Chawkbazar, Cumilla",5356962.86
Kandirpar,4.0,2530,4,19,অনন্যা সিং,"৮৭৪, মধ্য মানিকবাজার মহল্লা, Kandirpar, Cumilla",10858538.19
Jhawtala,3.8,1953,3,2,শেখর মজুমদার,"৬২৩, হোসেনগাঁ, Jhawtala, Cumilla",9724895.71
Tomsom Bridge,3.0,1245,2,17,ইজাজ মৃধা,"৩৭৭, পশ্চিম সৈয়দগ্রাম ঘাট, Tomsom Bridge, Cumilla",5234266.31
Police Line,3.1,2186,3,24,এনামুল হাকিম,"৩, দক্ষিণ মুরাদহাট, Police Line, Cumilla",8004498.69
Jhawtala,3.8,2216,4,14,মৃনাল চ্যাটার্জি,"৩, মধ্য সুবর্ণচর, Jhawtala, Cumilla",10144917.24
Bagichagaon,3.5,1670,3,9,নাইম সিনহা,"২০, বাজিতমাটি, Bagichagaon, Cumilla",7177733.19
Kotbari,2.5,1742,3,19,সজীব আচার্য্য,"১, দেবীস্টেশন, Kotbari, Cumilla",6554721.25
Race Course,3.2,1450,2,9,রাজ মন্ডল,"৯, মুরাদগ্রাম সেন্টার, Race Course, Cumilla",7035132.63
Jhawtala,3.8,1500,2,18,জনা উদ্দিন,"১৯৯, পশ্চিম জীবনগ্রাম, Jhawtala, Cumilla",7076458.42
Kotbari,2.5,1994,3,22,আশ্বিনী চৌধুরী,"১, বন্দরগ্রাম রোড, Kotbari, Cumilla",7714610.92
Chawkbazar,2.2,1279,2,0,বিনয় বিশ্বাস,"২, ফুলগঞ্জ পার্ক, Chawkbazar, Cumilla",4932335.64
Kandirpar,4.0,1663,3,20,রায়হান আলম,"৮, কালীসেন্টার, Kandirpar, Cumilla",8243902.09
Chawkbazar,2.2,1996,3,9,ইমতিয়াজ আওয়াল,"২১১, নাজিরবাজার মোড়, Chawkbazar, Cumilla",7536595.7
Tomsom Bridge,3.0,1373,2,14,আব্বাস মৃধা,"১০৪, নাসিরবাড়ি রাস্তা, Tomsom Bridge, Cumilla",6115550.83
Jhawtala,3.8,1683,3,12,রায়হান আওয়াল,"১৯৫, উত্তর মুরাদগ্রাম, Jhawtala, Cumilla",9025192.21
Police Line,3.1,1105,2,6,ডলি মিঞা,"১, উত্তর অভয়স্ট্যান্ড, Police Line, Cumilla",5758343.31
Chawkbazar,2.2,800,2,19,রুদ্র বন্দোপাধ্যায়,"৬৪০, ফটিকগ্রাম মহাসড়ক, Chawkbazar, Cumilla",3999113.34
Jhawtala,3.8,1653,3,15,রাশেদ হুরাইরা,"৯৯৪, মাধবগাঁও, Jhawtala, Cumilla",8196156.93
Race Course,3.2,1672,3,21,শাওন মজুমদার,"৫৯৭, উত্তর মধুগাঁ, Race Course, Cumilla",7481555.62
Tomsom Bridge,3.0,1813,3,8,প্রিয় মৃধা,"২৫, মধ্য কুতুবগাঁও, Tomsom Bridge, Cumilla",7441911.55
Shashongacha,2.0,1278,2,17,চঞ্চল জামান,"৯১৭, সুন্দরদিয়া, Shashongacha, Cumilla",5232223.49
Jhawtala,3.8,1530,2,19,নাইম আক্তার,"৯৬৬, পশ্চিম নন্দীতলা চত্বর, Jhawtala, Cumilla",7684289.83
Kotbari,2.5,1325,2,4,মিনা জামান,"৮৯৫, কুমারগড় প্লাজা, Kotbari, Cumilla",5562624.02
Kotbari,2.5,1725,3,19,তামিম চৌধুরী,"৪১১, পুরাতন আলিরাস্তা, Kotbari, Cumilla",7185334.51
Police Line,3.1,1888,3,5,প্রিয়ম বর্মন,"৪, হাজীহার, Police Line, Cumilla",7735153.2
Dharmapur,1.8,1492,2,3,কাফি মজুমদার,"৪, সৈয়দমাটি প্লাজা, Dharmapur, Cumilla",6192476.31
Chawkbazar,2.2,1113,2,23,প্রিয়তি হোসাইন,"৯৮, উত্তর শিবদিয়া, Chawkbazar, Cumilla",4233528.25
Race Course,3.2,1973,3,13,অর্না বন্দোপাধ্যায়,"১৭৭, পূর্ব মুরাদগঞ্জ স্টেশন, Race Course, Cumilla",8503809.38
Police Line,3.1,1365,2,8,আরাধ্যা মৃধা,"৫৯, মহাদেবগঞ্জ লেন, Police Line, Cumilla",5936238.52
Chawkbazar,2.2,1862,3,12,ইজাজ হুরাইরা,"৯২৭, নতুন রায়প্লাজা, Chawkbazar, Cumilla",7125476.65
Dharmapur,1.8,1255,2,10,শাহজাহান উদ্দিন,"২২০, পুরাতন সুবর্ণতলা, Dharmapur, Cumilla",5668213.46
Shashongacha,2.0,1224,2,3,হৈমন্তী মন্ডল,"২২০, পলাশগড়, Shashongacha, Cumilla",5364887.54
Shashongacha,2.0,1832,3,19,মাধুরী যাদব,"৮৫৬, বেগমখালি, Shashongacha, Cumilla",7110314.11
Jhawtala,3.8,2116,3,22,সুশান্ত সরকার,"৪৪, নতুন গৌরগ্রাম, Jhawtala, Cumilla",9666993.25
Race Course,3.2,1546,2,0,অজিত দাশগুপ্তা,"৭৫, দক্ষিণ কালিয়াপুর, Race Course, Cumilla",7317303.95
Bagichagaon,3.5,1804,3,24,মৃনাল মন্ডল,"৩, উত্তর কালীসেন্টার, Bagichagaon, Cumilla",6627713.84
Shashongacha,2.0,1872,3,4,সজীব কাদের,"৩৫৪, পশ্চিম বদরগড় এভিনিউ, Shashongacha, Cumilla",8247998.94
Chawkbazar,2.2,2117,3,8,রাহুল মৃধা,"৯, উত্তর সখিগঞ্জ রাস্তা, Chawkbazar, Cumilla",8714136.06
Police Line,3.1,1676,3,20,প্রিতম মৃধা,"১, নতুন দেবস্ট্যান্ড, Police Line, Cumilla",8307823.66
Tomsom Bridge,3.0,1366,2,3,অক্ষয় মন্ডল,"৭১, পূর্ব বন্দরসেন্টার, Tomsom Bridge, Cumilla",6354157.99
Race Course,3.2,2511,4,11,রাশেদুল আওয়াল,"৬, বাজিতপুর প্লাজা, Race Course, Cumilla",10605958.09
Race Course,3.2,1617,2,2,সৌম্য মৃধা,"৯, বেগমসেন্টার, Race Course, Cumilla",6420281.27
Jhawtala,3.8,1709,3,9,ইমন মোড়ল,"২৬৩, সদরমোড়, Jhawtala, Cumilla",8576974.4
Chawkbazar,2.2,1157,2,0,অনন্যা আলম,"৪, উত্তর মধুখালি ঘাট, Chawkbazar, Cumilla",4812103.79
Police Line,3.1,1756,3,16,লিটন আলম,"৪৮০, পূর্ব মুরাদএভিনিউ, Police Line, Cumilla",7608770.5
Police Line,3.1,1822,3,18,মুশফিক প্রামানিক,"৯৭, মুরাদগাঁও, Police Line, Cumilla",7816177.27
Race Course,3.2,1934,3,13,খুশি উদ্দিন,"৬৯৬, মহেশকর্নার, Race Course, Cumilla",8451513.92
Dharmapur,1.8,2431,4,0,সজীব সিনহা,"৯, বোরহানবাজার, Dharmapur, Cumilla",10021306.35
Kandirpar,4.0,1845,3,19,শান্ত মজুমদার,"৭০, পূর্ব মোড়ললেন, Kandirpar, Cumilla",8572003.44
Kandirpar,4.0,1192,2,14,বিপাশা ব্যানার্জি,"৭০, নড়িয়াগড় রাস্তা, Kandirpar, Cumilla",6576207.7
Police Line,3.1,1215,2,4,ইউসুফ বিশ্বাস,"১, মনিরামগঞ্জ, Police Line, Cumilla",5188554.92
Dharmapur,1.8,1089,2,2,ইউসুফ চৌধুরী,"৭, দক্ষিণ দাউদগ্রাম, Dharmapur, Cumilla",5143446.62
Bagichagaon,3.5,1548,2,14,অভি বিশ্বাস,"৬, আলিচর, Bagichagaon, Cumilla",6949391.28
Shashongacha,2.0,1048,2,5,সুশান্ত সরকার,"৬৫, মধ্য ফুলএভিনিউ, Shashongacha, Cumilla",4999367.78
Dharmapur,1.8,1822,3,19,অক্ষয় প্রামানিক,"৮, হাজীমহাসড়ক, Dharmapur, Cumilla",5435748.03
Police Line,3.1,1071,2,3,প্রত্যয় দেব,"৭, মধ্য ফকিরদিয়া মোড়, Police Line, Cumilla",5740069.56
Chawkbazar,2.2,1418,2,1,একরামুল আওয়াল,"২, মোহাম্মদগড় সেন্টার, Chawkbazar, Cumilla",5447018.1
Kotbari,2.5,1400,2,6,রাজু মৃধা,"৩০৩, চিতলগড়, Kotbari, Cumilla",6484392.96
Kotbari,2.5,1134,2,20,আব্বাস প্রামানিক,"৩৭, জগন্নাথপ্লাজা, Kotbari, Cumilla",5318097.31
Bagichagaon,3.5,1590,2,22,ঋষিতা কান্ত,"৭০১, মোহাম্মদসেন্টার, Bagichagaon, Cumilla",7247012.29
Tomsom Bridge,3.0,1736,3,21,রাজ মন্ডল,"৯৮৩, দক্ষিণ নন্দীনগর, Tomsom Bridge, Cumilla",7915169.69
Kotbari,2.5,1035,2,14,দূর্গা সরকার,"৪, বন্দরগড় সেন্টার, Kotbari, Cumilla",4292076.1
Chawkbazar,2.2,1690,3,10,বিপাশা ঠাকুর,"৯, মধ্য কাজীতলা প্লাজা, Chawkbazar, Cumilla",6172563.55
Tomsom Bridge,3.0,1455,2,6,রাজু বর্মন,"১৩, পূর্ব জীবনপ্লাজা, Tomsom Bridge, Cumilla",6588134.67
Tomsom Bridge,3.0,2032,3,7,অর্পিতা চৌধুরী,"৬, লালহার, Tomsom Bridge, Cumilla",8854077.13
Jhawtala,3.8,1588,2,19,মুনতাকিম মজুমদার,"৯৬, পশ্চিম নাসিরবাজার মহাসড়ক, Jhawtala, Cumilla",7465059.12
Kotbari,2.5,1655,3,23,চয়ন বর্মন,"২৫, সৈয়দগাঁ স্টেশন, Kotbari, Cumilla",6955694.07
Shashongacha,2.0,1467,2,3,বাসির সিনহা,"৫৭০, পশ্চিম সুন্দরগলি, Shashongacha, Cumilla",5196980.2
Police Line,3.1,2241,4,24,লতা রাও,"৮৫০, বিরামবাড়ি, Police Line, Cumilla",8451564.61
Dharmapur,1.8,2079,3,10,বিপাশা মৃধা,"৬, পুরাতন তেরমাটি, Dharmapur, Cumilla",8126890.08
Tomsom Bridge,3.0,1584,2,17,প্রীতি ব্যানার্জি,"৫৫, দক্ষিণ শাজাহানগঞ্জ স্টেশন, Tomsom Bridge, Cumilla",6897056.53
Kandirpar,4.0,1442,2,4,মাধু বাগচী,"৫৭৭, পুরাতন বদররাস্তা, Kandirpar, Cumilla",7137077.26
Chawkbazar,2.2,1051,2,3,শেখর চৌধুরী,"২৩, পুরাতন মনিরামসড়ক, Chawkbazar, Cumilla",5486749.26
Tomsom Bridge,3.0,1462,2,10,চঞ্চল তালুকদার,"৯, পশ্চিম দৌলতচর স্টেশন, Tomsom Bridge, Cumilla",6449790.33
Kotbari,2.5,2129,3,21,আজম তাবাসসুম,"৮৮, মধ্য মোড়লখালি সড়ক, Kotbari, Cumilla",8693539.22
Kotbari,2.5,1266,2,18,তুষার আওয়াল,"২০২, মহাদেবদিয়া পার্ক, Kotbari, Cumilla",5215052.25
Jhawtala,3.8,1308,2,19,সাব্বির চৌধুরী,"৬৪০, কমলচর সড়ক, Jhawtala, Cumilla",7084450.4
Race Course,3.2,1712,3,6,ইকবাল বিশ্বাস,"৩৯, দক্ষিণ কুতুবগাঁও গলি, Race Course, Cumilla",8128719.87
Police Line,3.1,1238,2,10,তন্ময় রাও,"২৮, দেবীসড়ক, Police Line, Cumilla",6278249.17
Dharmapur,1.8,1197,2,5,শুভ সিনহা,"৫১৫, রামপার্ক, Dharmapur, Cumilla",5656383.0
Jhawtala,3.8,1176,2,10,কাবেরি চৌধুরী,"২, নতুন গৌরস্টেশন, Jhawtala, Cumilla",5655600.04
Chawkbazar,2.2,896,2,13,রাসেল কাদের,"৩, মনিরামসড়ক, Chawkbazar, Cumilla",4189210.77
Chawkbazar,2.2,1202,2,17,আদি দাস,"৭, সদরচত্বর, Chawkbazar, Cumilla",5202550.62
Tomsom Bridge,3.0,1410,2,10,আশ্বিনী চৌধুরী,"৮২, মনিরামমোড়, Tomsom Bridge, Cumilla",6848783.17
Police Line,3.1,1603,2,14,তুষার প্রামানিক,"৬, বদরঘাট, Police Line, Cumilla",6879363.71
Bagichagaon,3.5,1609,2,19,আশীষ সাহা,"৯৪৭, উত্তর ফকিরবাড়ি, Bagichagaon, Cumilla",7289227.95
Dharmapur,1.8,1832,3,0,বাদল উদ্দিন,"১, শরণগঞ্জ সড়ক, Dharmapur, Cumilla",7501552.15
Kotbari,2.5,2154,3,0,সৌম্য দত্ত,"৪, পূর্ব নন্দীতলা প্লাজা, Kotbari, Cumilla",8675256.52
Tomsom Bridge,3.0,1681,3,9,ইকবাল মৃধা,"২১৭, দক্ষিণ সুন্দরপাড়া, Tomsom Bridge, Cumilla",6245935.61
Kandirpar,4.0,879,2,19,প্রিয়ম বন্দোপাধ্যায়,"৪, দক্ষিণ হোসেনগ্রাম প্লাজা, Kandirpar, Cumilla",4887387.36
Tomsom Bridge,3.0,1743,3,6,আশালতা বন্দোপাধ্যায়,"১৭, উত্তর মহেশগড়, Tomsom Bridge, Cumilla",7634319.53
Tomsom Bridge,3.0,1511,2,1,আনন্দ তালুকদার,"১, সুন্দরস্টেশন, Tomsom Bridge, Cumilla",6153112.05
Kandirpar,4.0,1518,2,22,রিনা যাদব,"৬৩, নতুন বাকেরস্ট্যান্ড, Kandirpar, Cumilla",7360781.08
Dharmapur,1.8,1656,3,15,জয়দীপ কান্ত,"৭, মহেশমাটি, Dharmapur, Cumilla",6686721.88
Kandirpar,4.0,1123,2,0,মাধু মৃধা,"৩৭৭, মধ্য কুমারহাট মোড়, Kandirpar, Cumilla",6132693.63
Race Course,3.2,1500,2,1,মনোজ সরকার,"৯, দক্ষিণ কালীগাঁও স্টেশন, Race Course, Cumilla",6786139.77
Tomsom Bridge,3.0,1149,2,23,সাবের মিঞা,"৫০, পশ্চিম দেবীস্টেশন, Tomsom Bridge, Cumilla",4118185.84
Jhawtala,3.8,1138,2,11,আনন্দ কাদের,"৬, নন্দীরাস্তা, Jhawtala, Cumilla",5932215.58
Bagichagaon,3.5,872,2,18,অশোক দাশগুপ্তা,"৮৬৪, উত্তর ব্রাহ্মণমাটি সেন্টার, Bagichagaon, Cumilla",5245386.63
Chawkbazar,2.2,2109,3,6,তামিম আবদুল্লাহ,"৩৬, শান্তিসড়ক, Chawkbazar, Cumilla",7894542.61
Tomsom Bridge,3.0,2189,3,16,সৌমিক মোড়ল,"৭৫৪, মধ্য আলমডাঙ্গা এভিনিউ, Tomsom Bridge, Cumilla",8819244.76
Bagichagaon,3.5,1431,2,19,মাধুরী তালুকদার,"৪২৫, কুতুবএভিনিউ, Bagichagaon, Cumilla",6634400.78
Shashongacha,2.0,1437,2,20,অদিতি সরকার,"৫, মোড়লতলা, Shashongacha, Cumilla",5433341.62
Kandirpar,4.0,1250,2,6,বাসির সিনহা,"৫৯৪, নতুন ফটিকডাঙ্গা রোড, Kandirpar, Cumilla",6740979.3
Kandirpar,4.0,1659,3,10,চঞ্চল আচার্য্য,"৪, মিরদিয়া পাড়া, Kandirpar, Cumilla",7593365.35
Kotbari,2.5,1720,3,9,মিষ্টি চৌধুরী,"৭, দক্ষিণ মিরডাঙ্গা কর্নার, Kotbari, Cumilla",7090635.63
Dharmapur,1.8,1572,2,11,ইমতিয়াজ প্রামানিক,"৯৮২, পূর্ব ফটিকগ্রাম প্লাজা, Dharmapur, Cumilla",6016280.84
Kotbari,2.5,1478,2,17,খুশি বসু,"৯, জগন্নাথচত্বর, Kotbari, Cumilla",6029138.78
Dharmapur,1.8,1437,2,6,মৃত্যুঞ্জয় সিনহা,"৩, পশ্চিম উজিরমহল্লা, Dharmapur, Cumilla",5820106.46
Race Course,3.2,1006,2,21,সাব্বির হুরাইরা,"৫২, উত্তর নালিতারাস্তা, Race Course, Cumilla",4251297.9
Tomsom Bridge,3.0,971,2,21,অভি চ্যাটার্জি,"২, পূর্ব দেবীদিয়া, Tomsom Bridge, Cumilla",4600191.69
Police Line,3.1,1152,2,5,আকাশ বিশ্বাস,"৭৫০, মোহাম্মদস্টেশন, Police Line, Cumilla",5510714.76
Bagichagaon,3.5,800,2,6,রহিম মজুমদার,"৮৯, পশ্চিম হাকিমলেন, Bagichagaon, Cumilla",4706177.03
Dharmapur,1.8,1220,2,13,শ্রাবনী হুরাইরা,"৬৯, নতুন হাকিমপার্ক, Dharmapur, Cumilla",3806984.16
Dharmapur,1.8,1306,2,24,অদৃতা মৃধা,"৩৪, পলাশডাঙ্গা, Dharmapur, Cumilla",5038897.18
Dharmapur,1.8,1854,3,12,ইমতিয়াজ সিনহা,"৮০, পুরাতন দেবখালি মোড়, Dharmapur, Cumilla",6123638.86
Jhawtala,3.8,961,2,7,শুভশ্রী মন্ডল,"৩, জগন্নাথমাটি, Jhawtala, Cumilla",5476435.8
Dharmapur,1.8,1548,2,10,মুনতাসির হোসাইন,"১৯, পুরাতন নালিতাবাজার কর্নার, Dharmapur, Cumilla",5030347.58
Police Line,3.1,1654,3,14,অন্তরা চৌধুরী,"৯, সুন্দরএভিনিউ, Police Line, Cumilla",7669508.81
Race Course,3.2,2329,4,23,জগদীশ সিনহা,"৯১, মধ্য রানীখালি, Race Course, Cumilla",8874127.87
Bagichagaon,3.5,1564,2,24,করিম আরা,"২৮৬, দক্ষিণ চৌদ্দখালি পার্ক, Bagichagaon, Cumilla",6190392.34
Tomsom Bridge,3.0,1760,3,21,মাধুরী মিশ্র,"১, লালখালি, Tomsom Bridge, Cumilla",7179440.53
Police Line,3.1,1517,2,8,শ্রাবন্তী সেন,"৪, ফকিরমহাসড়ক, Police Line, Cumilla",5985290.03
Kandirpar,4.0,2641,4,13,আয়ুশি সরকার,"৫৫৬, কাজীপুর স্টেশন, Kandirpar, Cumilla",11754392.29
Bagichagaon,3.5,2173,3,13,নয়ন তালুকদার,"৭, ওসমানীসেন্টার, Bagichagaon, Cumilla",10291198.37
Chawkbazar,2.2,1501,2,14,অজিত আচার্য্য,"৩৮৫, মধ্য ব্রাহ্মণচত্বর, Chawkbazar, Cumilla",6811302.38
Tomsom Bridge,3.0,1503,2,24,কেয়া হাকিম,"২৬, কমলবাড়ি, Tomsom Bridge, Cumilla",6806618.72
Kotbari,2.5,1739,3,16,অশোক মন্ডল,"৬৬, মহাদেবমোড়, Kotbari, Cumilla",7691088.14
Police Line,3.1,2030,3,14,আয়ুশি বাগচী,"২২৯, পূর্ব তারাচর, Police Line, Cumilla",8182091.17
Shashongacha,2.0,1606,2,24,অজয় বিশ্বাস,"৮৬, শান্তিগঞ্জ গলি, Shashongacha, Cumilla",6109634.93
Bagichagaon,3.5,2795,5,13,বিদ্যা সিনহা,"৬৬১, সৈয়দপাড়া, Bagichagaon, Cumilla",11712623.87
Dharmapur,1.8,1032,2,23,বাকের চৌধুরী,"১৪, পূর্ব হাকিমলেন, Dharmapur, Cumilla",3535533.07
Tomsom Bridge,3.0,921,2,17,আজাদ মৃধা,"৪, বিশ্বনাথগড়, Tomsom Bridge, Cumilla",5658314.01
Police Line,3.1,800,2,1,আলিয়া প্রামানিক,"২২, মুরাদগ্রাম কর্নার, Police Line, Cumilla",4152218.45
Dharmapur,1.8,2095,3,13,জয়দীপ মৃধা,"৬৬২, নতুন মনিরামঘাট, Dharmapur, Cumilla",7931591.5
Race Course,3.2,1109,2,5,কাফি মৃধা,"৭৬৫, পূর্ব মানিকদিয়া মহল্লা, Race Course, Cumilla",5704734.14
Kandirpar,4.0,1792,3,20,অনন্যা ব্যানার্জি,"৫৭৯, সুবর্ণগ্রাম রোড, Kandirpar, Cumilla",8728560.59
Chawkbazar,2.2,800,2,23,মিনা পাল,"৯, দৌলতগঞ্জ লেন, Chawkbazar, Cumilla",3334254.06
Dharmapur,1.8,1362,2,5,চঞ্চল বিশ্বাস,"৩৩, পূর্ব ইসলামচর, Dharmapur, Cumilla",4590109.5
Tomsom Bridge,3.0,1928,3,17,মাধুরী সিনহা,"১৭৫, সুবর্ণবাড়ি, Tomsom Bridge, Cumilla",7945115.67
Dharmapur,1.8,1892,3,3,শ্রাবনী বাগচী,"৪৩৩, উত্তর মাধবরোড, Dharmapur, Cumilla",7766715.86
Chawkbazar,2.2,1826,3,18,প্রদীপ মন্ডল,"৪৪, ওসমানীমাটি, Chawkbazar, Cumilla",7549804.73
Tomsom Bridge,3.0,1834,3,9,রোহিত মন্ডল,"৫৭৫, উত্তর দৌলতদিয়া, Tomsom Bridge, Cumilla",7313280.83
Dharmapur,1.8,1745,3,9,শ্রাবনী প্রধান,"৭, নতুন লালচর প্লাজা, Dharmapur, Cumilla",7042609.91
Kandirpar,4.0,1531,2,3,রাজ সিনহা,"৭০, নতুন বটিয়াহার মহাসড়ক, Kandirpar, Cumilla",8270612.81
Race Course,3.2,1566,2,23,ইকবাল আলম,"৭, পার্বতীএভিনিউ, Race Course, Cumilla",7452094.72
Chawkbazar,2.2,2616,4,1,আশ্বিনী মোড়ল,"৭৩০, পুরাতন সখিপার্ক, Chawkbazar, Cumilla",11562944.32
Bagichagaon,3.5,1758,3,19,কুনাল সিনহা,"৩, গৌরনগর, Bagichagaon, Cumilla",8020242.39
Police Line,3.1,1106,2,16,বাকের আক্তার,"৯, রামরোড, Police Line, Cumilla",5792941.83
Jhawtala,3.8,1225,2,15,আনিস মৃধা,"৫৩, কুমারমাটি কর্নার, Jhawtala, Cumilla",6517089.91
Police Line,3.1,1685,3,12,রিনা তালুকদার,"৫২, পশ্চিম বালিয়াচত্বর, Police Line, Cumilla",6572163.79
Jhawtala,3.8,1328,2,1,রাসেল হোসাইন,"৫, তেরচর সড়ক, Jhawtala, Cumilla",7399227.36
Shashongacha,2.0,1249,2,4,মিনা চ্যাটার্জি,"২১, পশ্চিম করিমগাঁ স্টেশন, Shashongacha, Cumilla",6018434.96
Bagichagaon,3.5,1656,3,19,প্রান্ত ঘোষ,"৫, দক্ষিণ দৌলতগ্রাম, Bagichagaon, Cumilla",7815074.38
Chawkbazar,2.2,2040,3,17,খুশি প্রামানিক,"৩৮৫, রামমাটি, Chawkbazar, Cumilla",7403000.16
Chawkbazar,2.2,1653,3,5,রাশেদ সিনহা,"৫৬, গৌরহার, Chawkbazar, Cumilla",6939467.56
Kandirpar,4.0,1201,2,16,মনোজ সিনহা,"৮৭১, কাজীগ্রাম, Kandirpar, Cumilla",6694528.05
Jhawtala,3.8,2005,3,16,অদৃতা পোদ্দার,"১৭৩, সিরাজনগর এভিনিউ, Jhawtala, Cumilla",8545825.33
Chawkbazar,2.2,1584,2,15,মিলা চন্দ্র,"৭৭৪, সিরাজতলা, Chawkbazar, Cumilla",6280803.59
Tomsom Bridge,3.0,1187,2,4,আসাদ সরকার,"৫৭১, কমলমাটি, Tomsom Bridge, Cumilla",5451251.4
Police Line,3.1,1729,3,14,আয়ুশি মন্ডল,"২, দৌলতডাঙ্গা, Police Line, Cumilla",7918738.78
Shashongacha,2.0,1481,2,23,আকাশ পোদ্দার,"৬, মধ্য তারাপ্লাজা, Shashongacha, Cumilla",6223500.07
Jhawtala,3.8,1298,2,19,আবির হোসাইন,"৮৭, কালিয়াডাঙ্গা, Jhawtala, Cumilla",6070538.26
Jhawtala,3.8,1692,3,14,রুদ্র আওয়াল,"১৩, মোহাম্মদঘাট, Jhawtala, Cumilla",7437682.24
Dharmapur,1.8,1540,2,14,বাকের রহমান,"৫৩৭, বাজিতলেন, Dharmapur, Cumilla",5845334.64
Police Line,3.1,1684,3,18,মুনতাকিম খান,"৭২৪, পুরাতন মোহাম্মদহাট রোড, Police Line, Cumilla",7552571.03
Kotbari,2.5,1871,3,23,তামিম খান,"৫০, মধ্য রায়হার গলি, Kotbari, Cumilla",7237638.53
Jhawtala,3.8,1568,2,5,আরিয়া সরকার,"৪৬, শ্যামচর পাড়া, Jhawtala, Cumilla",7775270.25
Chawkbazar,2.2,1627,2,6,অনিন্দিতা বোস,"৬০, মধুডাঙ্গা মহল্লা, Chawkbazar, Cumilla",7005299.91
Kotbari,2.5,800,2,12,অঞ্জনা বিশ্বাস,"২০, করিমঘাট, Kotbari, Cumilla",3340781.27
Bagichagaon,3.5,1848,3,8,প্রদ্যুম্ন মৃধা,"৮৩৬, পলাশসড়ক, Bagichagaon, Cumilla",8337583.03
Tomsom Bridge,3.0,1696,3,22,আজম ইসলাম,"৯৮৫, বদরতলা পাড়া, Tomsom Bridge, Cumilla",6451193.55
Kandirpar,4.0,1674,3,8,আরিয়ান আলম,"৩৬, হাকিমপুর লেন, Kandirpar, Cumilla",7394695.31
