Area,Location_Score,Square_Feet,Num_Bedrooms,Building_Age,Owner_Name,Street_Address,Price_BDT
Bagichagaon,3.5,1415,2,4,মাধুরী মৃধা,"৪১৪, নড়িয়াখালি, Bagichagaon, Cumilla",6520259.55
Kotbari,2.5,1544,2,2,মিনা তালুকদার,"৯৮০, অভয়পার্ক, Kotbari, Cumilla",6824152.59
Jhawtala,3.8,2220,4,23,আব্বাস মোড়ল,"২০, ফটিকমাটি, Jhawtala, Cumilla",9186689.29
Tomsom Bridge,3.0,2162,3,7,নয়ন আবদুল্লাহ,"৬, সখিহার গলি, Tomsom Bridge, Cumilla",8673552.77
Tomsom Bridge,3.0,877,2,5,কুনাল চট্টোপাধ্যায়,"৪৬, পুরাতন বিজয়ডাঙ্গা চত্বর, Tomsom Bridge, Cumilla",4475211.1
Tomsom Bridge,3.0,1875,3,22,প্রিতম হাকিম,"৯, মধ্য ফকিরগাঁও স্ট্যান্ড, Tomsom Bridge, Cumilla",7209462.14
Tomsom Bridge,3.0,1501,2,9,মাধুরী দে,"৯, মধ্য কালিয়াডাঙ্গা এভিনিউ, Tomsom Bridge, Cumilla",6078324.56
Dharmapur,1.8,1202,2,24,বাসির আবদুল্লাহ,"৬, উত্তর বিশ্বনাথগঞ্জ চত্বর, Dharmapur, Cumilla",4969949.69
Police Line,3.1,2022,3,21,একরামুল আবদুল্লাহ,"৩, কুতুববাজার, Police Line, Cumilla",8863227.04
Dharmapur,1.8,1824,3,18,মাধুরী দাশগুপ্তা,"৭০, পূর্ব হাজীনগর মহাসড়ক, Dharmapur, Cumilla",6214636.78
Kotbari,2.5,2140,3,20,নাদিম আরা,"৪০৪, পুরাতন মোল্লাতলা গলি, Kotbari, Cumilla",8072354.14
Police Line,3.1,1785,3,14,বাঁধন মন্ডল,"৪২৪, চিতলমাটি, Police Line, Cumilla",7817953.03
Dharmapur,1.8,1165,2,21,আয়ুষ মজুমদার,"৮, চিতলমাটি প্লাজা, Dharmapur, Cumilla",3926853.63
Chawkbazar,2.2,1208,2,4,শান্ত মৃধা,"৪৭৮, মির্জাখালি সড়ক, Chawkbazar, Cumilla",5450770.28
Tomsom Bridge,3.0,1394,2,24,অজিত সিং,"৬৩৯, পশ্চিম পলাশপ্লাজা, Tomsom Bridge, Cumilla",5720714.78
Chawkbazar,2.2,1260,2,20,জয়দীপ মন্ডল,"৭৫৯, বাকেরগাঁ, Chawkbazar, Cumilla",6142608.95
Kotbari,2.5,2529,4,4,আবু চৌধুরী,"৭৫৬, পূর্ব আলিগ্রাম, Kotbari, Cumilla",10040488.44
Chawkbazar,2.2,1787,3,2,রাসেল মজুমদার,"৯, বিজয়বাড়ি পাড়া, Chawkbazar, Cumilla",6977331.67
Jhawtala,3.8,1316,2,21,আতাহার ইসলাম,"৪, রায়এভিনিউ, Jhawtala, Cumilla",6728689.29
Dharmapur,1.8,1223,2,19,মোস্তাফিজ প্রামানিক,"৮, বিজয়দিয়া, Dharmapur, Cumilla",4938524.64
Race Course,3.2,1616,2,24,অনিন্দিতা মৃধা,"৭৩২, মধ্য রায়সড়ক, Race Course, Cumilla",7144572.16
Shashongacha,2.0,1072,2,23,মুনতাকিম মৃধা,"৬, পুরাতন শ্যামগাঁ পাড়া, Shashongacha, Cumilla",3237961.04
Kotbari,2.5,2147,3,24,চঞ্চল দে,"৬৬, পাইকনগর প্লাজা, Kotbari, Cumilla",9014907.69
Tomsom Bridge,3.0,2107,3,1,তুষার বসু,"৮০১, নড়িয়াতলা, Tomsom Bridge, Cumilla",9126473.17
Police Line,3.1,1128,2,11,অশোক কুমার,"২, মধ্য পাইকরোড, Police Line, Cumilla",5095106.31
Dharmapur,1.8,1013,2,17,মুনতাসির তালুকদার,"৬২, নতুন দাউদপার্ক, Dharmapur, Cumilla",3588944.59
Race Course,3.2,1449,2,16,রাজ চৌধুরী,"৩৯৫, মুরাদপুর লেন, Race Course, Cumilla",6585341.32
Bagichagaon,3.5,1725,3,15,প্রান্ত চট্টোপাধ্যায়,"২৯, পশ্চিম লালডাঙ্গা, Bagichagaon, Cumilla",7677996.73
Bagichagaon,3.5,1139,2,5,ইশতিয়াক হুরাইরা,"২৭৭, শ্যামলেন, Bagichagaon, Cumilla",5730050.92
Jhawtala,3.8,1489,2,21,ইউসুফ মোড়ল,"৫২১, মুরাদগঞ্জ রাস্তা, Jhawtala, Cumilla",7663218.88
Chawkbazar,2.2,1154,2,22,আশালতা মন্ডল,"৫৫১, পার্বতীতলা, Chawkbazar, Cumilla",4612456.48
Chawkbazar,2.2,1852,3,11,ঈশানি বসু,"৪৭৮, সুবর্ণনগর, Chawkbazar, Cumilla",7561766.73
Chawkbazar,2.2,1508,2,22,মোস্তাফিজ সিনহা,"৬, মাধববাজার এভিনিউ, Chawkbazar, Cumilla",6473451.25
Kandirpar,4.0,2056,3,3,প্রশান্ত সাহা,"৬১১, পশ্চিম আনোয়ারগাঁ সেন্টার, Kandirpar, Cumilla",9632511.62
Shashongacha,2.0,1151,2,5,নাদিম চৌধুরী,"৭৪০, পশ্চিম বকশীরোড, Shashongacha, Cumilla",5103823.05
Tomsom Bridge,3.0,1225,2,2,রায়হান মন্ডল,"১৯, নতুন মোহাম্মদতলা পাড়া, Tomsom Bridge, Cumilla",5457472.13
Shashongacha,2.0,1254,2,17,নাদিম হুরাইরা,"৩, দক্ষিণ মোহনগঞ্জ, Shashongacha, Cumilla",4354129.3
Police Line,3.1,1921,3,15,প্রদ্যুম্ন বসু,"৬, মিরতলা, Police Line, Cumilla",7597902.09
Race Course,3.2,1729,3,10,মনোজ তালুকদার,"৮৫৬, পশ্চিম বিশ্বনাথপ্লাজা, Race Course, Cumilla",7158895.1
Shashongacha,2.0,1858,3,18,রুদ্র ইসলাম,"৪৭, বাজিতগলি, Shashongacha, Cumilla",7529910.18
Kandirpar,4.0,2054,3,20,শহিদুল মৃধা,"৪, পূর্ব ফুলপাড়া, Kandirpar, Cumilla",10447494.67
Jhawtala,3.8,1980,3,5,আশীষ বসু,"১৬৫, ফুলগ্রাম, Jhawtala, Cumilla",8847327.1
Bagichagaon,3.5,1641,2,6,মুশফিক তালুকদার,"২৮৪, তারাগাঁও মহল্লা, Bagichagaon, Cumilla",7291028.17
Shashongacha,2.0,1589,2,5,অভি বোস,"৪৫০, নতুন সুন্দরবাজার সেন্টার, Shashongacha, Cumilla",6523366.06
Police Line,3.1,1728,3,2,শাহাবাজ বিশ্বাস,"৬০১, নতুন নাজিরমহল্লা, Police Line, Cumilla",8009902.26
Jhawtala,3.8,1827,3,15,মিলা মিশ্র,"৪১৮, পুরাতন শান্তিগড়, Jhawtala, Cumilla",8571526.45
Kandirpar,4.0,1740,3,23,ইজাজ তালুকদার,"৮, তারাকর্নার, Kandirpar, Cumilla",7988846.68
Kandirpar,4.0,1738,3,6,আনন্দ হোসাইন,"১, কাজীচর, Kandirpar, Cumilla",8227377.93
Chawkbazar,2.2,800,2,12,অশোক সিনহা,"৮৮২, পূর্ব মুরাদখালি, Chawkbazar, Cumilla",3211868.14
Kotbari,2.5,1674,3,12,কাফি মৃধা,"৪০৩, পশ্চিম আনোয়ারডাঙ্গা, Kotbari, Cumilla",6374583.26
Police Line,3.1,1863,3,7,সৌম্য রাও,"৯১, আলিখালি, Police Line, Cumilla",7708856.63
Police Line,3.1,852,2,5,নাদিম রহমান,"৪, পশ্চিম কমলবাজার, Police Line, Cumilla",4457040.44
Shashongacha,2.0,1766,3,0,নাদিম মজুমদার,"৭২৯, দক্ষিণ পলাশগড়, Shashongacha, Cumilla",6428264.8
Kotbari,2.5,1279,2,21,রিনা বেগম,"১৫৩, দাউদগাঁ, Kotbari, Cumilla",5043468.75
Kotbari,2.5,1893,3,14,আশীষ যাদব,"৮৩০, পশ্চিম বালিয়াসেন্টার, Kotbari, Cumilla",8617742.16
Race Course,3.2,1239,2,9,মোস্তাফিজ রহমান,"৭০৬, বোরহানহাট পার্ক, Race Course, Cumilla",5442451.71
Jhawtala,3.8,810,2,21,শাহাবাজ তালুকদার,"৫৩৬, সুন্দরপার্ক, Jhawtala, Cumilla",4674086.51
Chawkbazar,2.2,1405,2,8,তনয় হোসাইন,"৬, শিবতলা, Chawkbazar, Cumilla",5522376.36
Chawkbazar,2.2,1616,2,21,চঞ্চল প্রামানিক,"৪৯৯, উজিরকর্নার, Chawkbazar, Cumilla",5379390.95
Kotbari,2.5,1585,2,13,আশ্বিনী মৃধা,"২৫, মুরাদবাড়ি, Kotbari, Cumilla",6003125.66
Bagichagaon,3.5,1798,3,16,রায়হান চৌধুরী,"৪৪০, পুরাতন হরিরামদিয়া, Bagichagaon, Cumilla",8324917.76
Police Line,3.1,1488,2,10,মুনতাসির কাদের,"৯৭, জগন্নাথগড় গলি, Police Line, Cumilla",6691530.51
Shashongacha,2.0,3123,5,6,তনয় সিনহা,"৪৪, ফুলস্টেশন, Shashongacha, Cumilla",12654430.93
Bagichagaon,3.5,800,2,5,অন্তরা শুক্লা,"৮১৪, শ্যামবাজার ঘাট, Bagichagaon, Cumilla",5883329.39
Jhawtala,3.8,1364,2,19,আবির হাকিম,"৮, পশ্চিম মহাদেবসেন্টার, Jhawtala, Cumilla",6984062.47
Tomsom Bridge,3.0,1225,2,9,প্রিয় কাদের,"৫৭৮, পাইকগাঁও, Tomsom Bridge, Cumilla",5243466.87
Jhawtala,3.8,1067,2,14,রহিম আক্তার,"৬, পুরাতন শরণগাঁও, Jhawtala, Cumilla",4534674.45
Kandirpar,4.0,1637,2,18,ইকবাল চৌধুরী,"৩১১, ইসলামবাজার, Kandirpar, Cumilla",7406788.21
Kotbari,2.5,1526,2,15,ইশিতা বসু,"৯, সুবর্ণতলা, Kotbari, Cumilla",5805173.33
Tomsom Bridge,3.0,2400,4,16,মুনতাকিম ইসলাম,"১২৮, রায়গাঁও মহাসড়ক, Tomsom Bridge, Cumilla",9474018.94
Bagichagaon,3.5,1360,2,11,আয়ুষ সেন,"৯, মধ্য রানীগাঁও, Bagichagaon, Cumilla",7181197.09
Jhawtala,3.8,2259,4,5,প্রদীপ সিনহা,"৬৯, সৈয়দরাস্তা, Jhawtala, Cumilla",9289369.14
Tomsom Bridge,3.0,1959,3,17,ইজাজ মোড়ল,"২৯৮, মোল্লাস্টেশন, Tomsom Bridge, Cumilla",8176504.02
Race Course,3.2,1223,2,24,লিটন মন্ডল,"৩৪, ইসলামগ্রাম, Race Course, Cumilla",6110963.62
Police Line,3.1,1843,3,6,অনিন্দিতা মোড়ল,"৯২, কাজীডাঙ্গা, Police Line, Cumilla",7259622.93
Kandirpar,4.0,1239,2,13,কুনাল প্রধান,"৬৫, শরণঘাট, Kandirpar, Cumilla",5792473.95
Dharmapur,1.8,1322,2,19,মাধু প্রামানিক,"৮, পশ্চিম বিজয়গ্রাম ঘাট, Dharmapur, Cumilla",5122618.12
Dharmapur,1.8,1148,2,18,অঞ্জনা বোস,"৩, সুবর্ণডাঙ্গা স্টেশন, Dharmapur, Cumilla",4558448.79
Chawkbazar,2.2,2147,3,10,রিনা তাবাসসুম,"৩, পশ্চিম হাকিমগঞ্জ, Chawkbazar, Cumilla",6929779.33
Shashongacha,2.0,1317,2,22,বাকের মন্ডল,"৮৫, মুরাদস্টেশন, Shashongacha, Cumilla",4736493.66
Shashongacha,2.0,1780,3,22,কেয়া গাঙ্গুলি,"৪৮৩, পূর্ব হরিরামগাঁও, Shashongacha, Cumilla",6927220.01
Shashongacha,2.0,1613,2,15,অর্ক জামান,"৮৪, নতুন সুন্দরগ্রাম পাড়া, Shashongacha, Cumilla",6037570.96
Kotbari,2.5,1986,3,23,সাব্বির খাতুন,"৬, পূর্ব বোরহানতলা রাস্তা, Kotbari, Cumilla",7464219.74
Kandirpar,4.0,1477,2,21,প্রত্যয় আবদুল্লাহ,"৬০১, পশ্চিম ফকিরদিয়া লেন, Kandirpar, Cumilla",6832062.26
Bagichagaon,3.5,1856,3,9,সাবের বিশ্বাস,"৪, দক্ষিণ মিরডাঙ্গা প্লাজা, Bagichagaon, Cumilla",9529430.91
Jhawtala,3.8,1256,2,9,প্রশান্ত দাশগুপ্তা,"৫৯, দক্ষিণ সৈয়দগড়, Jhawtala, Cumilla",5978995.45
Kandirpar,4.0,1201,2,12,হৈমন্তী তালুকদার,"৪১, রায়বাড়ি প্লাজা, Kandirpar, Cumilla",6829441.41
Race Course,3.2,1228,2,13,অর্পিতা সরকার,"৫৩, মধ্য মনোহরগাঁও চত্বর, Race Course, Cumilla",6009080.65
Shashongacha,2.0,1659,3,10,করিম মন্ডল,"৫০১, শ্যামতলা, Shashongacha, Cumilla",5023723.77
Dharmapur,1.8,1634,2,10,একরামুল সরকার,"৯২১, চিতলমহাসড়ক, Dharmapur, Cumilla",6856066.29
Chawkbazar,2.2,1177,2,2,আরুণি মজুমদার,"৬, নতুন আনোয়ারতলা সেন্টার, Chawkbazar, Cumilla",4344650.49
Tomsom Bridge,3.0,1305,2,5,প্রিয়াঙ্কা গঙ্গোপাধ্যায়,"৯৫, সৈয়দপুর গলি, Tomsom Bridge, Cumilla",6051878.29
Kandirpar,4.0,1067,2,6,খুশি জাহান,"৫৭, পুরাতন বন্দরতলা চত্বর, Kandirpar, Cumilla",6115503.56
Kandirpar,4.0,1828,3,24,চয়ন প্রামানিক,"৭৮৫, মহাদেবসেন্টার, Kandirpar, Cumilla",8193217.92
Race Course,3.2,1231,2,2,প্রান্ত প্রামানিক,"৬৫১, কবিরচর রাস্তা, Race Course, Cumilla",6686061.02
Race Course,3.2,976,2,16,প্রিতম ঘোষ,"৬৫, দক্ষিণ বালিয়ানগর স্টেশন, Race Course, Cumilla",4844405.58
Bagichagaon,3.5,2075,3,22,অশোক মজুমদার,"২, নতুন দাউদগাঁ, Bagichagaon, Cumilla",8359410.6
Chawkbazar,2.2,1710,3,4,অলোকা গাঙ্গুলি,"৩৭, পশ্চিম সৈয়দস্টেশন, Chawkbazar, Cumilla",6902115.8
Tomsom Bridge,3.0,1976,3,13,তুষার মজুমদার,"৯৭১, লালগলি, Tomsom Bridge, Cumilla",7724280.42
Bagichagaon,3.5,1970,3,17,রহিম আরা,"৮০৭, পুরাতন রায়বাড়ি, Bagichagaon, Cumilla",8866536.08
Shashongacha,2.0,951,2,18,বাদল দেব,"৭৩৪, জগন্নাথহাট, Shashongacha, Cumilla",3696976.84
Tomsom Bridge,3.0,936,2,19,রাহুল বাগচী,"৯৭, নড়িয়াচর, Tomsom Bridge, Cumilla",4501639.47
Dharmapur,1.8,1431,2,8,অদৃতা মৃধা,"৫০১, নতুন জগন্নাথসেন্টার, Dharmapur, Cumilla",6672300.43
Police Line,3.1,2408,4,6,নন্দিতা সেন,"১০, সোনামাটি লেন, Police Line, Cumilla",9661048.14
Police Line,3.1,1886,3,21,কুনাল দে,"৬০, নাজিরগ্রাম প্লাজা, Police Line, Cumilla",8081342.41
Bagichagaon,3.5,1592,2,10,আদি খান,"১০০, মাধবদিয়া মোড়, Bagichagaon, Cumilla",8114720.58
Kandirpar,4.0,2222,4,16,নয়ন আলি,"৭৯৬, নাসিরডাঙ্গা পার্ক, Kandirpar, Cumilla",10059721.5
Kotbari,2.5,1815,3,7,জনা মিত্র,"১৩, পশ্চিম ফুলডাঙ্গা মহাসড়ক, Kotbari, Cumilla",6934195.58
Chawkbazar,2.2,800,2,8,আমায়া প্রামানিক,"২২, সদরপুর রাস্তা, Chawkbazar, Cumilla",3509806.06
Dharmapur,1.8,1314,2,19,শাহজাহান আওয়াল,"৬, উত্তর মাধবগঞ্জ পার্ক, Dharmapur, Cumilla",5232866.27
Chawkbazar,2.2,1616,2,5,বিদ্যা আচার্য্য,"৮, পূর্ব দাউদএভিনিউ, Chawkbazar, Cumilla",6547672.4
Race Course,3.2,2190,3,5,অলোকা দত্ত,"৯৯৮, নতুন মানিকগাঁ, Race Course, Cumilla",9904890.27
Shashongacha,2.0,1659,3,11,অক্ষয় সরকার,"৪, সোনামাটি, Shashongacha, Cumilla",6834049.53
Police Line,3.1,1958,3,6,রহিম সরকার,"১, সুন্দরহাট রাস্তা, Police Line, Cumilla",8148306.52
Chawkbazar,2.2,1422,2,1,অঞ্জনা সিনহা,"৫, পশ্চিম বটিয়ামাটি, Chawkbazar, Cumilla",5951120.81
Kotbari,2.5,1802,3,5,আশীষ দাশগুপ্তা,"৫২, মহাদেবলেন, Kotbari, Cumilla",9107705.13
Jhawtala,3.8,1684,3,7,মুশফিক হক,"৬৮২, ইসলামমোড়, Jhawtala, Cumilla",7599321.62
Dharmapur,1.8,1603,2,7,কাবেরি চ্যাটার্জি,"৩২৬, উত্তর বিশ্বনাথতলা চত্বর, Dharmapur, Cumilla",6677605.44
Chawkbazar,2.2,1599,2,19,রুদ্র খান,"৬, পশ্চিম বকশীমহল্লা, Chawkbazar, Cumilla",5951484.71
Kandirpar,4.0,800,2,8,মুনতাকিম মজুমদার,"৬৯, দক্ষিণ বন্দরগ্রাম, Kandirpar, Cumilla",4229684.69
Dharmapur,1.8,1782,3,24,মিথিলা হক,"১, পুরাতন মনোহরকর্নার, Dharmapur, Cumilla",6211020.3
Jhawtala,3.8,1817,3,4,হৈমন্তী তালুকদার,"৫৫৫, পশ্চিম আলমগঞ্জ মহাসড়ক, Jhawtala, Cumilla",8225091.08
Dharmapur,1.8,1558,2,7,বৃষ্টি আরা,"৬, মধ্য সুন্দরমহল্লা, Dharmapur, Cumilla",5871229.88
Bagichagaon,3.5,1426,2,5,কাবেরি মজুমদার,"৬২৮, দক্ষিণ ফকিরপার্ক, Bagichagaon, Cumilla",6988260.9
Police Line,3.1,2037,3,6,নয়ন মৃধা,"৯, মধ্য পাইকপাড়া, Police Line, Cumilla",8993157.9
Shashongacha,2.0,1847,3,3,আবু আবদুল্লাহ,"২০, নতুন বাজিতহার সেন্টার, Shashongacha, Cumilla",6899771.93
Kotbari,2.5,2028,3,2,শাহাবাজ আক্তার,"৩, দক্ষিণ রায়পুর, Kotbari, Cumilla",8279292.56
Chawkbazar,2.2,1387,2,12,চঞ্চল আবদুল্লাহ,"৬৯৯, শ্যামমাটি, Chawkbazar, Cumilla",5244740.39
Jhawtala,3.8,1445,2,0,প্রশান্ত ঠাকুর,"১৫৮, মধ্য জগন্নাথদিয়া মোড়, Jhawtala, Cumilla",8056107.27
Jhawtala,3.8,2306,4,11,কাজল সুলতানা,"৬৪, উত্তর কালীতলা চত্বর, Jhawtala, Cumilla",10806808.49
Dharmapur,1.8,1165,2,9,বিদ্যা দাশগুপ্তা,"৮৬২, পশ্চিম মহাদেবডাঙ্গা স্ট্যান্ড, Dharmapur, Cumilla",4460181.15
Bagichagaon,3.5,1651,3,4,রাশেদুল আরা,"৯০, বেগমহাট, Bagichagaon, Cumilla",6827401.44
Shashongacha,2.0,1841,3,5,বিনা প্রামানিক,"২৭, সোনাবাজার সড়ক, Shashongacha, Cumilla",7957980.76
Tomsom Bridge,3.0,1857,3,20,প্রিয়ম মৃধা,"১৩, মনিরামডাঙ্গা পাড়া, Tomsom Bridge, Cumilla",8429283.94
Kandirpar,4.0,1445,2,5,আলিয়া মন্ডল,"৪৮৬, মধ্য গৌরবাজার চত্বর, Kandirpar, Cumilla",8066932.95
Tomsom Bridge,3.0,928,2,14,আরাধ্যা মুখার্জি,"৪, পশ্চিম নাসিরস্টেশন, Tomsom Bridge, Cumilla",4981213.93
Shashongacha,2.0,1681,3,23,নাদিম আলি,"৭, পশ্চিম ইসলামরোড, Shashongacha, Cumilla",6130272.41
Chawkbazar,2.2,1849,3,4,আবু আবদুল্লাহ,"১৪, দক্ষিণ নড়িয়ারাস্তা, Chawkbazar, Cumilla",7448306.99
Kotbari,2.5,1483,2,19,কবিতা বাগচী,"১৮, দক্ষিণ মহেশগঞ্জ রাস্তা, Kotbari, Cumilla",5857274.95
Shashongacha,2.0,1751,3,3,ঋষিতা পাল,"২, পশ্চিম সখিতলা, Shashongacha, Cumilla",6934880.64
Bagichagaon,3.5,1430,2,10,অঞ্জনা ইসলাম,"৪২, উত্তর রামএভিনিউ, Bagichagaon, Cumilla",6772880.39
Tomsom Bridge,3.0,976,2,14,আয়ুশি বন্দোপাধ্যায়,"৯, পূর্ব চৌদ্দঘাট, Tomsom Bridge, Cumilla",4985968.3
Tomsom Bridge,3.0,1612,2,1,জয়দীপ কুমার,"৩, পূর্ব হোসেনরোড, Tomsom Bridge, Cumilla",7568755.6
Police Line,3.1,1400,2,22,দূর্গা চৌধুরী,"৬, শিবগ্রাম, Police Line, Cumilla",6505295.78
Kandirpar,4.0,1366,2,8,করিম রহমান,"৭৩, নতুন ফকিরসেন্টার, Kandirpar, Cumilla",7236200.93
Shashongacha,2.0,1511,2,8,আরিয়া উদ্দিন,"৩, পুরাতন হাকিমবাড়ি মহল্লা, Shashongacha, Cumilla",5830675.3
Bagichagaon,3.5,2320,4,23,অদৃতা মজুমদার,"৮, সৈয়দদিয়া, Bagichagaon, Cumilla",9422128.38
Kandirpar,4.0,2115,3,23,মৃত্যুঞ্জয় মিশ্র,"২২৬, পশ্চিম দেবীপুর, Kandirpar, Cumilla",9470789.76
Police Line,3.1,2470,4,19,নাইম বেগম,"৩, ওসমানীখালি চত্বর, Police Line, Cumilla",10410736.79
Kandirpar,4.0,2527,4,22,রাজু দাশগুপ্তা,"৩, বিরামমহল্লা, Kandirpar, Cumilla",10217124.44
Jhawtala,3.8,1023,2,16,আরাধ্যা ব্যানার্জি,"৫, উত্তর তারাকর্নার, Jhawtala, Cumilla",5403677.07
Police Line,3.1,1241,2,2,অনিন্দিতা তালুকদার,"৯৮, মোহাম্মদকর্নার, Police Line, Cumilla",6679797.95
Bagichagaon,3.5,1774,3,0,আরুণি পোদ্দার,"৬১, মনিরামগ্রাম লেন, Bagichagaon, Cumilla",8409997.22
Kandirpar,4.0,1459,2,16,প্রদীপ মোড়ল,"৩২১, জীবনগঞ্জ, Kandirpar, Cumilla",6706779.62
Dharmapur,1.8,1367,2,18,রাজু দাশগুপ্তা,"৫৩৮, উত্তর গৌরচত্বর, Dharmapur, Cumilla",4976664.56
Chawkbazar,2.2,1378,2,11,ইমতিয়াজ আওয়াল,"৭৭৮, দাউদরোড, Chawkbazar, Cumilla",5889330.49
Race Course,3.2,2245,4,13,জগদীশ চৌধুরী,"৪, তারাগলি, Race Course, Cumilla",10145798.14
Jhawtala,3.8,2074,3,21,খুশি দাস,"২, পশ্চিম সুবর্ণলেন, Jhawtala, Cumilla",9115606.39
Bagichagaon,3.5,999,2,3,ইজাজ তালুকদার,"৫৬৯, কাজীমাটি মোড়, Bagichagaon, Cumilla",6741281.97
Police Line,3.1,1995,3,13,অর্না দত্ত,"৩, পুরাতন বিজয়তলা স্ট্যান্ড, Police Line, Cumilla",8275815.7
Shashongacha,2.0,1759,3,23,অভিষেক আবদুল্লাহ,"৫, পশ্চিম কমলগড়, Shashongacha, Cumilla",5777645.73
Police Line,3.1,1198,2,0,ইকবাল মন্ডল,"৭৮৮, মধ্য লালগলি, Police Line, Cumilla",5816478.35
Race Course,3.2,1911,3,19,বিনা শুক্লা,"১, মির্জানগর গলি, Race Course, Cumilla",7927762.92
Kotbari,2.5,1829,3,0,অদিতি সেন,"৬৯, উত্তর কালিয়াগ্রাম, Kotbari, Cumilla",7441058.31
Race Course,3.2,1593,2,7,প্রিয়াঙ্কা সিং,"৩, দক্ষিণ নন্দীবাজার মোড়, Race Course, Cumilla",7406046.93
Tomsom Bridge,3.0,1435,2,3,সজীব কাদের,"৪৫, পশ্চিম জগন্নাথগ্রাম, Tomsom Bridge, Cumilla",6422225.94
Dharmapur,1.8,1285,2,7,রোহিত গঙ্গোপাধ্যায়,"৫৯, পশ্চিম মিরগড়, Dharmapur, Cumilla",4738183.99
Police Line,3.1,1956,3,8,ঋষিতা বিশ্বাস,"৬, দেববাজার, Police Line, Cumilla",7924577.98
Chawkbazar,2.2,1529,2,9,কেয়া মোড়ল,"৫, নতুন সৈয়দলেন, Chawkbazar, Cumilla",6323223.61
Kotbari,2.5,1305,2,7,আবু সিনহা,"৮০৫, নাজিরগাঁ সড়ক, Kotbari, Cumilla",5269419.74
Jhawtala,3.8,1121,2,11,অর্পিতা খান,"৭৯, মধুডাঙ্গা স্টেশন, Jhawtala, Cumilla",6264854.28
Jhawtala,3.8,2130,3,6,বিনা পাণ্ডে,"৯২৬, মধ্য শ্যামতলা, Jhawtala, Cumilla",10009926.39
Dharmapur,1.8,1960,3,24,তন্ময় যাদব,"৬২, গৌরপার্ক, Dharmapur, Cumilla",7739836.16
Kandirpar,4.0,1788,3,19,ইউসুফ সুলতানা,"৮৪, উত্তর হাকিমগাঁ সড়ক, Kandirpar, Cumilla",8856585.12
Kotbari,2.5,2062,3,1,মুনতাসির হোসাইন,"৮, নতুন সিরাজমাটি ঘাট, Kotbari, Cumilla",8333127.91
